{
  "schemaVersion":"1.0.0","id":"host.expired","version":1,"name":"Expired host rule","enabled":true,
  "source":"prometheus","query":"up == 0","scope":{"environment":"integration","service":"host","domain":"host"},
  "severity":"warning","labels":{"managed_by":"infra","approval_status":"approved","notify":"mattermost"},
  "annotations":{"summary":"Expired","description":"Expired test rule","runbookUrl":"https://docs.example.invalid/runbooks/host"},
  "notification":{"groupBy":["alertname","environment","service","severity"],"sendResolved":true},
  "approval":{"status":"approved","approvedBy":"infra-owner","approvedAt":"2025-01-01T00:00:00Z","changeRef":"fixture"},"owner":"infra","expiresAt":"2025-01-02T00:00:00Z"
}
